{
  "schema_version": "2.0",
  "task_id": "PROJECT-LEADER-TRUSTED-GATE-SCOPE-SUBSET-012",
  "project": "PROJECT LEADER",
  "repository": "martaxi-boss/Project-leader",
  "created_at": "2026-10-03T07:52:00Z",
  "authority": {
    "kind": "TRANSACTIONAL_GRANT",
    "summary": "Owner explicitly authorizes correcting only the trusted-gate scope-ceiling bug that rejects exact or narrower mutation scopes contained within an allowed policy pattern. No unrelated changes are authorized.",
    "source": "CURRENT_OWNER_INSTRUCTION",
    "binding_mode": "OBJECTIVE_SCOPE_BOUND"
  },
  "starting_state": {
    "default_branch": "main",
    "base_sha": "a8eeff8f25ef9f632ed2542c167b2137a439f705",
    "task_branch": "builder/trusted-gate-scope-subset-fix-012",
    "pr_number": null
  },
  "effect_class": "E3_DESTRUCTIVE_EXTERNAL_PRIVILEGED",
  "mutation_scope": [
    ".project-leader/tasks/**",
    ".project-leader/results/**",
    ".project-leader/transitions/**",
    "control/**",
    "tests/**"
  ],
  "allowed_actions": [
    "create_branch",
    "edit_project_files",
    "create_commits",
    "run_ci",
    "open_or_update_pull_request",
    "harden_trust_root"
  ],
  "prohibited_actions": [
    "merge_to_main",
    "branch_protection_or_ruleset_change",
    "release_or_publish",
    "license_selection",
    "managed_project_mutation",
    "production_deploy",
    "production_secret_change",
    "paid_service_activation",
    "repository_or_history_deletion",
    "force_push",
    "unrelated_refactor"
  ],
  "human_gates": [
    {
      "action": "merge_to_main",
      "requires_owner_approval": true
    },
    {
      "action": "branch_protection_or_ruleset_change",
      "requires_owner_approval": true
    },
    {
      "action": "release_or_publish",
      "requires_owner_approval": true
    },
    {
      "action": "license_selection",
      "requires_owner_approval": true
    },
    {
      "action": "managed_project_mutation",
      "requires_owner_approval": true
    },
    {
      "action": "trust_root_mutation",
      "requires_owner_approval": true
    }
  ],
  "required_validation": [
    "Mutation scope audit",
    "GitHub evidence verification",
    "Trust-root governance path",
    "Scope subset regression"
  ],
  "required_ci": [
    "Control contract tests",
    "Validate control plane",
    "Package ChatGPT plugins"
  ],
  "policy": {
    "binding_mode": "LOCAL_BASE_V1",
    "profile": "project-leader-v1",
    "path": "projects/policies/project-leader.json",
    "base_sha": "a8eeff8f25ef9f632ed2542c167b2137a439f705",
    "sha256": "9666860e6cf78c6e6ef67ef9ba8c3257cdc0db85af7ddaa9896a2dabe07081d0"
  },
  "recovery": {
    "mode": "APPEND_ONLY_V1"
  },
  "terminal_condition": "One isolated Project Leader PR changes only control/trusted_gate.py plus tests/test_trusted_gate.py and mandatory task/result/transition records so exact files and clearly narrower sub-patterns contained by an allowed policy ceiling pass, while widened patterns remain rejected. All required CI must pass. Stop before merge to main.",
  "privacy": {
    "contains_secrets": false,
    "contains_private_conversation_text": false
  },
  "integrity_mode": "IMMUTABLE_AUTHORIZATION_V1"
}
