{
  "schema_version": "2.0",
  "task_id": "PROJECT-LEADER-RECOVERY-STRUCTURAL-CAUSALITY-018",
  "project": "PROJECT LEADER",
  "repository": "martaxi-boss/Project-leader",
  "created_at": "2026-10-03T11:27:48.856Z",
  "authority": {
    "kind": "TRANSACTIONAL_GRANT",
    "summary": "Owner authorized correcting mapped universal Project Leader gaps one at a time. This task fixes only Recovery causal proof so FAILURE_OBSERVED and RETRY_AUTHORIZED must structurally precede the CI-certified implementation SHA and RECOVERED must structurally follow it, preventing old-SHA reruns from being certified by timestamps alone.",
    "source": "CURRENT_OWNER_INSTRUCTION",
    "binding_mode": "OBJECTIVE_SCOPE_BOUND"
  },
  "starting_state": {
    "default_branch": "main",
    "base_sha": "a282b96ee7961df767e5783330294cf61e6b52fa",
    "task_branch": "builder/recovery-structural-causality-018",
    "pr_number": null
  },
  "effect_class": "E3_DESTRUCTIVE_EXTERNAL_PRIVILEGED",
  "mutation_scope": [
    ".project-leader/tasks/**",
    ".project-leader/results/**",
    ".project-leader/transitions/**",
    "control/verify_github_evidence.py",
    "tests/**",
    "PROJECT_LEADER.md",
    "RUNBOOK.md",
    "RECOVERY_PROTOCOL.md",
    "plugins/project-leader/skills/project-leader/**",
    "plugins/recovery-guardian/skills/recovery-guardian/**"
  ],
  "allowed_actions": [
    "create_branch",
    "edit_project_files",
    "create_commits",
    "run_ci",
    "open_or_update_pull_request",
    "harden_trust_root",
    "add_authorization_integrity_binding",
    "reconcile_control_contract_docs"
  ],
  "prohibited_actions": [
    "merge_to_main",
    "branch_protection_or_ruleset_change",
    "release_or_publish",
    "license_selection",
    "managed_project_mutation",
    "production_deploy",
    "production_secret_change",
    "paid_service_activation",
    "repository_or_history_deletion",
    "force_push",
    "unrelated_refactor",
    "weaken_recovery_causality"
  ],
  "human_gates": [
    {
      "action": "merge_to_main",
      "requires_owner_approval": true
    },
    {
      "action": "branch_protection_or_ruleset_change",
      "requires_owner_approval": true
    },
    {
      "action": "release_or_publish",
      "requires_owner_approval": true
    },
    {
      "action": "license_selection",
      "requires_owner_approval": true
    },
    {
      "action": "managed_project_mutation",
      "requires_owner_approval": true
    },
    {
      "action": "trust_root_mutation",
      "requires_owner_approval": true
    }
  ],
  "required_validation": [
    "Mutation scope audit",
    "GitHub evidence verification",
    "Trust-root governance path",
    "Structural Recovery causal ordering"
  ],
  "required_ci": [
    "Control contract tests",
    "Validate control plane",
    "Package ChatGPT plugins"
  ],
  "policy": {
    "binding_mode": "LOCAL_BASE_V1",
    "profile": "project-leader-v1",
    "path": "projects/policies/project-leader.json",
    "base_sha": "a282b96ee7961df767e5783330294cf61e6b52fa",
    "sha256": "9666860e6cf78c6e6ef67ef9ba8c3257cdc0db85af7ddaa9896a2dabe07081d0"
  },
  "recovery": {
    "mode": "APPEND_ONLY_V1"
  },
  "terminal_condition": "Recovery certification requires Git ancestry proving failure/retry authorization events are ancestors of the CI-certified implementation SHA and successful RECOVERED evidence is a descendant of that SHA on the final line. Timestamp checks remain secondary. Old-SHA reruns cannot satisfy terminal Recovery certification. Required tests pass. Stop before merge to main.",
  "privacy": {
    "contains_secrets": false,
    "contains_private_conversation_text": false
  },
  "integrity_mode": "IMMUTABLE_AUTHORIZATION_V1"
}
