{
  "schema_version": "2.0",
  "task_id": "PROJECT-LEADER-AUTONOMOUS-CONVERGENCE-014",
  "project": "PROJECT LEADER",
  "repository": "martaxi-boss/Project-leader",
  "created_at": "2026-10-03T08:57:41.777Z",
  "authority": {
    "kind": "TRANSACTIONAL_GRANT",
    "summary": "Owner explicitly requires Project Leader to detect, audit, correct, validate and continue autonomously inside existing authority, stopping only when no covered work remains and the next irreducible action is a genuine Human Gate. Owner also requires correction of the generic recovery-causality gap so a retry cannot be certified by evidence persisted only after the retry.",
    "source": "CURRENT_OWNER_INSTRUCTION",
    "binding_mode": "OBJECTIVE_SCOPE_BOUND"
  },
  "starting_state": {
    "default_branch": "main",
    "base_sha": "c8c9643bfa39e746079043cfd83c1aae349b0462",
    "task_branch": "builder/autonomous-convergence-gate-recovery-014",
    "pr_number": null
  },
  "effect_class": "E3_DESTRUCTIVE_EXTERNAL_PRIVILEGED",
  "mutation_scope": [
    ".project-leader/tasks/**",
    ".project-leader/results/**",
    ".project-leader/transitions/**",
    "control/**",
    "tests/**",
    "PROJECT_LEADER.md",
    "RUNBOOK.md",
    "RECOVERY_PROTOCOL.md",
    "plugins/project-leader/skills/project-leader/**",
    "plugins/recovery-guardian/skills/recovery-guardian/**"
  ],
  "allowed_actions": [
    "create_branch",
    "edit_project_files",
    "create_commits",
    "run_ci",
    "open_or_update_pull_request",
    "harden_trust_root",
    "add_authorization_integrity_binding",
    "add_cross_repository_e2e_tests",
    "reconcile_control_contract_docs"
  ],
  "prohibited_actions": [
    "merge_to_main",
    "branch_protection_or_ruleset_change",
    "release_or_publish",
    "license_selection",
    "managed_project_mutation",
    "production_deploy",
    "production_secret_change",
    "paid_service_activation",
    "repository_or_history_deletion",
    "force_push",
    "weaken_human_gate_effect_boundaries",
    "unrelated_refactor"
  ],
  "human_gates": [
    {
      "action": "merge_to_main",
      "requires_owner_approval": true
    },
    {
      "action": "branch_protection_or_ruleset_change",
      "requires_owner_approval": true
    },
    {
      "action": "release_or_publish",
      "requires_owner_approval": true
    },
    {
      "action": "license_selection",
      "requires_owner_approval": true
    },
    {
      "action": "managed_project_mutation",
      "requires_owner_approval": true
    },
    {
      "action": "trust_root_mutation",
      "requires_owner_approval": true
    }
  ],
  "required_validation": [
    "Mutation scope audit",
    "GitHub evidence verification",
    "Trust-root governance path",
    "Autonomous convergence before Human Gate",
    "Recovery retry causal ordering"
  ],
  "required_ci": [
    "Control contract tests",
    "Validate control plane",
    "Package ChatGPT plugins"
  ],
  "policy": {
    "binding_mode": "LOCAL_BASE_V1",
    "profile": "project-leader-v1",
    "path": "projects/policies/project-leader.json",
    "base_sha": "c8c9643bfa39e746079043cfd83c1aae349b0462",
    "sha256": "9666860e6cf78c6e6ef67ef9ba8c3257cdc0db85af7ddaa9896a2dabe07081d0"
  },
  "recovery": {
    "mode": "APPEND_ONLY_V1"
  },
  "terminal_condition": "One isolated Project Leader PR enforces DETECT -> AUDIT -> CORRECT -> VALIDATE -> CONTINUE convergence before any Human Gate, and prevents retroactive retry authorization from satisfying recovery certification. Existing Human Gate effect classes remain unchanged. Required contract tests and plugin packaging are green. Stop before merge to main.",
  "privacy": {
    "contains_secrets": false,
    "contains_private_conversation_text": false
  },
  "integrity_mode": "IMMUTABLE_AUTHORIZATION_V1"
}
