{
  "schema_version": "2.0",
  "task_id": "PROJECT-LEADER-HUMAN-GATE-AUTONOMY-032",
  "project": "PROJECT LEADER",
  "repository": "martaxi-boss/Project-leader",
  "created_at": "2026-10-03T16:34:00Z",
  "authority": {
    "kind": "STANDING_DELEGATION",
    "summary": "Owner explicitly requires Project Leader to operate autonomously across registered projects: agents must coordinate by hierarchy, execute covered work, remediate and recover without repetitive approvals. Human interruption is reserved for exclusive human/manual intervention or a genuinely new uncovered material decision. Implement this gap narrowly and in phases without unrelated functional changes.",
    "source": "CURRENT_OWNER_INSTRUCTION",
    "binding_mode": "OBJECTIVE_SCOPE_BOUND"
  },
  "starting_state": {
    "default_branch": "main",
    "base_sha": "73c5512674b2f14d82d69f6f4a10a8f886cf0049",
    "task_branch": "builder/human-gate-autonomy-032",
    "pr_number": null
  },
  "effect_class": "E3_DESTRUCTIVE_EXTERNAL_PRIVILEGED",
  "mutation_scope": [
    ".project-leader/tasks/**",
    ".project-leader/results/**",
    ".project-leader/transitions/**",
    "control/**",
    "tests/**",
    "projects/**",
    "PROJECT_LEADER.md",
    "RUNBOOK.md",
    "RECOVERY_PROTOCOL.md",
    "AGENT_BUILDER_PROMPT.md",
    "roles/**",
    "plugins/**"
  ],
  "allowed_actions": [
    "create_branch",
    "edit_project_files",
    "create_commits",
    "run_ci",
    "open_or_update_pull_request",
    "harden_trust_root",
    "add_cross_repository_policy_binding",
    "repair_result_terminal_semantics",
    "add_semantic_registry_policy_validation",
    "add_cross_repository_e2e_tests",
    "reconcile_control_contract_docs",
    "reconcile_transition_records"
  ],
  "prohibited_actions": [
    "merge_to_main",
    "branch_protection_or_ruleset_change",
    "release_or_publish",
    "license_selection",
    "managed_project_mutation",
    "production_deploy",
    "production_secret_change",
    "paid_service_activation",
    "force_push",
    "rewrite_git_history",
    "repository_or_history_deletion",
    "destructive_data_change",
    "unrelated_project_feature_change"
  ],
  "human_gates": [
    {
      "action": "merge_to_main",
      "requires_owner_approval": true
    },
    {
      "action": "branch_protection_or_ruleset_change",
      "requires_owner_approval": true
    },
    {
      "action": "release_or_publish",
      "requires_owner_approval": true
    },
    {
      "action": "license_selection",
      "requires_owner_approval": true
    },
    {
      "action": "managed_project_mutation",
      "requires_owner_approval": true
    },
    {
      "action": "trust_root_mutation",
      "requires_owner_approval": true
    }
  ],
  "required_validation": [
    "Mutation scope audit",
    "GitHub evidence verification",
    "Trust-root governance path",
    "Standing authority semantics",
    "Human-gate minimality",
    "Recovery autonomy semantics"
  ],
  "required_ci": [
    "Control contract tests",
    "Validate control plane",
    "Package ChatGPT plugins"
  ],
  "policy": {
    "profile": "project-leader-v1",
    "path": "projects/policies/project-leader.json",
    "base_sha": "73c5512674b2f14d82d69f6f4a10a8f886cf0049",
    "sha256": "9d185a662234060031ef6919238a480c2a419adf4cbf60f71f31ca376500ea1d",
    "binding_mode": "LOCAL_BASE_V1"
  },
  "recovery": {
    "mode": "APPEND_ONLY_V1"
  },
  "terminal_condition": "Project Leader canonical contracts and managed-project policies must persist the Owner standing autonomy grant, stop treating routine executable transitions such as normal merge-to-main as automatic Human Gates, keep objective evidence/audit/recovery protections intact, and reserve human interruption for exclusive human/manual intervention or a genuinely new uncovered material decision. Changes must be phased, tested, audited, and integrated without unrelated project mutations.",
  "privacy": {
    "contains_secrets": false,
    "contains_private_conversation_text": false
  },
  "integrity_mode": "IMMUTABLE_AUTHORIZATION_V1"
}
