{
  "schema_version": "2.0",
  "task_id": "PROJECT-LEADER-HYGIENE-POLICY-025B",
  "project": "PROJECT LEADER",
  "repository": "martaxi-boss/Project-leader",
  "created_at": "2026-10-03T12:36:47.930Z",
  "authority": {
    "kind": "TRANSACTIONAL_GRANT",
    "summary": "Owner explicitly authorized completing Project Leader repository hygiene. This prerequisite adds only two narrowly-scoped E3 policy actions needed for safe hygiene: deleting non-main branch refs proven fully contained in main, and installing automatic cleanup of same-repository merged PR head branches. Supersedes stale packet 025.",
    "source": "CURRENT_OWNER_INSTRUCTION",
    "binding_mode": "OBJECTIVE_SCOPE_BOUND"
  },
  "starting_state": {
    "default_branch": "main",
    "base_sha": "aa39702a3d2fb7d5c211cc088c1badc06663b9f3",
    "task_branch": "builder/hygiene-policy-025b",
    "pr_number": null
  },
  "effect_class": "E3_DESTRUCTIVE_EXTERNAL_PRIVILEGED",
  "mutation_scope": [
    ".project-leader/tasks/**",
    ".project-leader/results/**",
    ".project-leader/transitions/**",
    "projects/policies/project-leader.json",
    "tests/**"
  ],
  "allowed_actions": [
    "create_branch",
    "edit_project_files",
    "create_commits",
    "run_ci",
    "open_or_update_pull_request",
    "harden_trust_root"
  ],
  "prohibited_actions": [
    "merge_to_main",
    "branch_protection_or_ruleset_change",
    "release_or_publish",
    "license_selection",
    "managed_project_mutation",
    "production_deploy",
    "production_secret_change",
    "paid_service_activation",
    "delete_any_branch_ref",
    "force_push",
    "rewrite_git_history",
    "unrelated_refactor"
  ],
  "human_gates": [
    {
      "action": "merge_to_main",
      "requires_owner_approval": true
    },
    {
      "action": "branch_protection_or_ruleset_change",
      "requires_owner_approval": true
    },
    {
      "action": "release_or_publish",
      "requires_owner_approval": true
    },
    {
      "action": "license_selection",
      "requires_owner_approval": true
    },
    {
      "action": "managed_project_mutation",
      "requires_owner_approval": true
    },
    {
      "action": "trust_root_mutation",
      "requires_owner_approval": true
    }
  ],
  "required_validation": [
    "Mutation scope audit",
    "GitHub evidence verification",
    "Trust-root governance path",
    "Repository hygiene action ceiling validation"
  ],
  "required_ci": [
    "Control contract tests",
    "Validate control plane",
    "Package ChatGPT plugins"
  ],
  "policy": {
    "binding_mode": "LOCAL_BASE_V1",
    "profile": "project-leader-v1",
    "path": "projects/policies/project-leader.json",
    "base_sha": "aa39702a3d2fb7d5c211cc088c1badc06663b9f3",
    "sha256": "f4991d3db97e233d0d47d559ff7c6cd3480f3934d66c21ac65ffe411445de4e6"
  },
  "recovery": {
    "mode": "APPEND_ONLY_V1"
  },
  "terminal_condition": "Canonical Project Leader policy explicitly allows only the two bounded hygiene actions under E3: delete_fully_merged_non_main_branch_refs and install_automatic_merged_pr_branch_hygiene. No branch is deleted by this prerequisite task. Required tests and trusted gate pass; stop before merge to main.",
  "privacy": {
    "contains_secrets": false,
    "contains_private_conversation_text": false
  },
  "integrity_mode": "IMMUTABLE_AUTHORIZATION_V1"
}
